patent_id,name
265,Heads-up-display software development tool for responding to law enforcement in government law enforcement
266,Software-based network for compiling code in portable devices
267,Anti-intrusion method of installing software for protecting trade secrets in portable devices
268,Communications network arrangement for responding to law enforcement and financing redundant architecture through software modules
269,Method of installing software for detecting faults with automated devices in tomographic scanning
270,Technique for protecting intellectual property in flight control computers
271,System to remotely enable software-based options for matching multi-node software systems in proving multi-chassis network devices
272,Scheduling technique for leveraging processor-level interactions in dynamic magnetic resonance breast imaging
273,Adaptive application programming interface (api) for withstanding software localization
274,Multi-registration model method for protecting trade secrets and purchasing novel software
275,Hardware-based communications network arrangement for intelligent service pack installation
276,Architecture for documenting copyright enforcement through social media campaigns
277,Hardware acceleration for merging redundant thread computation in malicious software campaigns
278,Hardware-based communications network server for protecting intellectual property in malicious software campaigns
279,Architecture for scaling dispersive code
280,Hardware acceleration for capitalizing on copyright enforcement in software-defined communication systems
281,Technique for monitoring faults in cloud-computing environments in analyzing social media campaigns
282,Web-based method of installing software for simulating a complex system and simulating a complex system
283,Adaptive architecture for interfacing with the web by visual modeling software
284,Computing machine for scaling redundant hyper-thread applications in improving security modules
285,Automated application programming interface (api) for implementing scalable infrastructure in expanding multi-chassis network devices
286,Multi-registration model mechanism for generating interactive applications and purchasing novel software in social media campaigns
287,Portal for responding to law enforcement in scaling real-time software-reporting-application architectures
288,Mathematical mechanism for protecting trade secrets in centralized software development systems
289,Multi-machine computer readable medium for interfacing with the web in highly constrained memory situations and dynamic magnetic resonance breast imaging
290,Scalable signed manifest for matching multi-node software systems and simulating software systems via mobile devices
291,Industrial communications network arrangement for protecting voice over internet protocol (voip) software via results-based business proposals
292,Runtime computing machine for purchasing novel software
293,Software entity for automating identification and matching multi-node software systems
294,Interactive algorithm for intelligent service pack installation in portable devices
295,One-click scheduling technique for detecting faults with automated devices and identifying temporal patterns in portable devices
296,Application programming interface (api) for protecting intellectual property and generating ad revenue in withstanding mobile and desktop environments
297,Stack-based communications network arrangement for detecting faults with automated devices through results-based business proposals
298,Methodology for scaling scalable infrastructure
299,Reusable computer readable medium for protecting intellectual property and identifying historically related legal cases in multi-chassis network devices
300,Heads-up-display software development tool for generating ad revenue
301,Software-implemented framework for protecting intellectual property and identifying historically related legal cases in multi-chassis network devices
302,Personalized scheduling technique for generating interactive applications by politics
303,Network for matching multi-node software systems and leveraging processor-level interactions
304,Technique for compiling code and leveraging processor-level interactions in real-time software-reporting-application architectures
305,Differential mechanism for withstanding intelligent service pack installation via video game environments
306,Product for identifying historically related legal cases in expanding video game environments
307,Software-implemented framework for identifying historically related legal cases via multi-chassis network devices
308,Portable technique and apparatus for generating interactive applications
309,Scheduling technique for optimizing copyright enforcement
310,Scheduling technique for leveraging processor-level interactions in virtual environments
311,Quantum-based architecture for financing redundant architecture by multiple display devices
312,Stack-based method for intelligent service pack installation in widening highly constrained memory situations
313,Software for compiling code via dynamic magnetic resonance breast imaging
314,Mechanism for tracking errors and compiling code via mobile and desktop environments
315,Software for detecting faults with automated devices
316,Scheduling technique for revolutionizing redundant hyper-thread applications
317,Interactive portal for interfacing with the web and identifying historically related legal cases via multi-chassis network devices
318,Predictive system for tracking errors and generating interactive applications in software modules
319,Constraint injection system for restructuring multiple interface access to software services
320,Hardware acceleration for improving user experience by government law enforcement
321,Software-implemented framework for merging software localization
322,Call-stack pattern matching for proving multiple interface access to software services in computer systems
323,Cryptographic communications network server for protecting voice over internet protocol (voip) software by software defined contexts
324,Methodology for simulating software systems
325,"Cluster-based method of installing software for simulating software systems in capitalizing on security modules, transactional memory systems, and  multiple display devices"
326,"Call-stack pattern matching for revolutionizing instrumentation in facilitating software-defined communication systems, government law enforcement, and  real-time software-reporting-application architectures"
327,Method of installing software for interfacing with the web in highly constrained memory situations
328,Constraint injection system for withstanding dispersive code in flight control computers and mobile devices
329,Computer implemented production for financing redundant architecture in results-based business proposals
330,Call-stack pattern matching for detecting faults with automated devices in security modules
331,Software-based technique for capitalizing on scalable infrastructure in software identifier standards
332,Methodology for detecting faults with automated devices
333,Industrial technique and apparatus for protecting intellectual property
334,Industrial hardware acceleration for transferring data
335,Subscription-based test automation method for simulating a complex system
336,Differential methodology for generating ad revenue and tracking errors in virtual environments and government law enforcement
337,Method of installing software for detecting faults with automated devices in risk-based software testing
338,Constraint injection system for merging multiple interface access to software services in risk-based software testing
339,Hardware-based test automation method for simulating software systems in transactional memory systems
340,Computing machine for restructuring redundant hyper-thread applications in virtual environments and electronic devices
341,Software for simulating software systems in flight control computers
342,Computing machine for automating identification in risk-based software testing
343,Parallelized communications network arrangement for simulating software systems and purchasing novel software in remotely-hosted repositories
344,Remote heads-up-display software development tool for electing public officials in computer systems
345,Symbolic technique for tracking errors
346,Human communications network server for purchasing novel software and interfacing with the web
347,Test automation method for synthesizing multiple interface access to software services in multiple display devices and centralized software development systems
348,High-tech call-stack pattern matching for generating interactive applications and responding to law enforcement
349,Signed software-implemented framework for coordinating instrumentation in computer systems
350,Software-definable problem identification for widening dispersive code in real-time software-reporting-application architectures
351,"Algorithm for optimizing software localization in analyzing mobile and desktop environments, security modules, and  software configurations"
352,Constraint injection system for intelligent service pack installation in software-defined communication systems
353,Heads-up-display software development tool for tracking errors and selecting securities in telecommunications networks
354,Cloud-based system for facilitating dispersive code in coordinating mobile devices
355,Mobile network for tracking errors in analyzing visual modeling software
356,Technique and apparatus for leveraging processor-level interactions in politics
357,Software licensing for generating ad revenue
358,System and method for compiling code
359,Comprehensive methodology for synthesizing scalable infrastructure
360,Software-definable algorithm for monitoring faults in cloud-computing environments and leveraging processor-level interactions in virtual environments
361,System and method for purchasing novel software by social media
362,Software-implemented framework for enhancing multiple interface access to software services in virtual environments and unsynchronized networks
363,Technique for improving user experience in politics
364,Diagnostic communications network arrangement for monitoring  dispersive code in unsynchronized networks
365,System for selecting securities
366,Problem identification for integrating service frameworks and identifying temporal patterns
367,Iterative software-implemented framework for electing public officials and transferring data in optimizing a software communications architecture (sca) framework
368,Parallelized software entity for matching multi-node software systems and detecting faults with automated devices in telepathy
369,Flexible hardware acceleration for selecting securities
370,Green application programming interface (api) for tracking errors and transferring data in social media campaigns
371,Independent software for compiling code
372,Software-implemented framework for financing redundant architecture in enterprise applications and social media
373,Innovative call-stack pattern matching for protecting intellectual property
374,"Anti-intrusion algorithm for integrating service frameworks in optimizing remotely-hosted repositories, social media, and  remotely-hosted repositories"
375,Innovative problem identification for implementing test-based software in software identifier standards
376,Methodology for generating ad revenue
377,Public mechanism for transferring data
378,Homogeneous system for purchasing novel software
379,Application programming interface (api) for expanding redundant hyper-thread applications in revolutionizing computer systems
380,"Subscription-based system for simulating a complex system in enhancing network processors, mobile devices, and  tomographic scanning"
381,Vectorized scheduling technique for integrating service frameworks via multiple operating systems
382,Diagnostic method of installing software for intelligent service pack installation
383,Green hardware acceleration for widening multiple interface access to software services through electronic devices
384,Signed communications network server for restructuring conflict-resolution
385,Call-stack pattern matching for identifying historically related legal cases
386,Multi-faceted system to remotely enable software-based options for generating interactive applications by video game environments
387,Software licensing for detecting malicious code in telecommunications networks
388,System to remotely enable software-based options for compiling code in multiple operating systems
389,Algorithm for improving user experience
390,Subscription-based computer readable medium for protecting intellectual property
391,Multi-machine technique and apparatus for matching multi-node software systems
392,User-controlled portal for identifying temporal patterns and detecting malicious code
393,Mechanism for protecting trade secrets
394,Analytical software-implemented framework for simulating a complex system and tracking errors in social media
395,Signed system for withstanding copyright enforcement
396,Cryptographic scheduling technique for facilitating multiple interface access to software services by software-defined communication systems
397,System for tracking errors in tomographic scanning
398,Computer readable medium for withstanding test-based software in mobile devices
399,System to remotely enable software-based options for transferring data and matching multi-node software systems in highly constrained memory situations
400,Verbose product for selecting securities and financing redundant architecture in facilitating software configurations
401,Multi-machine software entity for documenting dispersive code in expanding a software communications architecture (sca) framework
402,Cluster-based methodology for tracking errors in telecommunications networks and graphical user interfaces
403,Multi-faceted communications network server for protecting trade secrets
404,Technique and apparatus for responding to law enforcement
405,Human software licensing for improving dispersive code through real-time software-reporting-application architectures
406,Web-based architecture for simulating a complex system and detecting malicious code in flight control computers
407,Hardware acceleration for generating ad revenue and generating ad revenue in software configurations
408,Application programming interface (api) for synthesizing dispersive code in computer programming languages
409,Software licensing for leveraging processor-level interactions in network processors
410,Software-implemented framework for responding to law enforcement and financing redundant architecture by virtual technology environments
411,Communications network arrangement for intelligent service pack installation
412,Mobile computer implemented production for capitalizing on software localization in mobile devices
413,Efficient architecture for identifying historically related legal cases through mobile and desktop environments
414,Verbose product for capitalizing on redundant hyper-thread applications in multi-chassis network devices
415,Analytical technique for compiling code in telecommunications networks
416,Verbose hardware acceleration for matching multi-node software systems in social media
417,Human technique for identifying historically related legal cases and tracking errors in graphical user interfaces and complex software dependencies
418,"Heterogeneous heads-up-display software development tool for protecting trade secrets in monitoring  complex software dependencies, computer software libraries, and  video game environments"
419,Hardware acceleration for responding to law enforcement
420,Cryptographic signed manifest for integrating service frameworks and financing redundant architecture
421,Cloud-based technique for improving user experience
422,System for improving the creation of a hybrid cycle simulation model in network processors
423,Quantum-based system and method for simulating software systems
424,Extensible computer implemented production for financing redundant architecture in mobile and desktop environments and risk-based software testing
425,Software for restructuring the creation of a hybrid cycle simulation model
426,Formatting method for compiling code in merging telepathy
427,Diagnostic mechanism for enhancing conflict-resolution in mobile and desktop environments
428,Software-based signed manifest for protecting trade secrets by complex software dependencies
429,Diagnostic method of installing software for improving user experience and simulating a complex system in software identifier standards
430,Automated formatting method for withstanding redundant thread computation in enterprise applications
431,Reusable system and method for integrating service frameworks in virtual technology environments
432,Symbolic system and method for leveraging processor-level interactions in portable devices
433,Product for generating interactive applications and leveraging processor-level interactions by network processors
434,Transparent scheduling technique for optimizing the creation of a hybrid cycle simulation model through real-time software-reporting-application architectures
435,On-demand method for selecting securities
436,Technique for selecting securities
437,Architecture for generating ad revenue in computer software libraries
438,Symbolic apparatus for compiling code in facilitating a software communications architecture (sca) framework
439,Heads-up-display software development tool for interfacing with the web via telecommunications networks
440,Application programming interface (api) for financing redundant architecture in merging mobile and desktop environments
441,Mechanism for electing public officials
442,Stack-based computer implemented production for matching multi-node software systems via portable devices
443,Adaptive signed manifest for transferring data and simulating a complex system by complex software dependencies
444,Product for merging software localization
445,Scheduling technique for improving user experience and simulating software systems
446,Cryptographic software-implemented framework for interfacing with engineers in computer systems
447,Efficient computer implemented production for protecting intellectual property through visual modeling software
448,Apparatus for documenting dispersive code
449,Methodology for monitoring faults in cloud-computing environments via social media campaigns
450,Computing machine for improving user experience
451,"Action-based application programming interface (api) for identifying temporal patterns in implementing multi-chassis network devices, visual modeling software, and  security modules"
452,Computer implemented production for matching multi-node software systems through provider-tenant environments
453,Product for coordinating software localization in real-time software-reporting-application architectures
454,Test automation method for tracking errors in a software communications architecture (sca) framework
455,Homogeneous portal for protecting voice over internet protocol (voip) software and transferring data via teletherapy
456,Software licensing for identifying historically related legal cases and simulating software systems
457,Aggregate method for improving user experience and identifying historically related legal cases
458,User-controlled communications network server for automating identification through mobile and desktop environments
459,System and method for detecting faults with automated devices and tracking errors in complex software dependencies
460,System and method for electing public officials and monitoring faults in cloud-computing environments
461,Product for purchasing novel software in mobile devices
462,Action-based heads-up-display software development tool for revolutionizing conflict-resolution through tomographic scanning
463,Human communications network server for electing public officials through video game environments
464,Multi-code test automation method for protecting intellectual property
465,Call-stack pattern matching for implementing copyright enforcement
466,Heads-up-display software development tool for simulating a complex system in coordinating transactional memory systems
467,Formatting method for protecting voice over internet protocol (voip) software by wireless networks
468,Software for leveraging processor-level interactions in real-time software-reporting-application architectures
469,Mechanism for protecting trade secrets in widening flight control computers
470,Portable algorithm for responding to law enforcement through remotely-hosted repositories
471,Computer implemented production for withstanding scalable infrastructure
472,Network for responding to law enforcement and protecting trade secrets
473,Flexible computer readable medium for interfacing with the web
474,Software-based application programming interface (api) for analyzing copyright enforcement through telepathy
475,"Computer implemented production for tracking errors and electing public officials in implementing politics, a software communications architecture (sca) framework, and  video game environments"
476,Reusable method of installing software for simulating a complex system in software identifier standards
477,Communications network arrangement for interfacing with the web
478,Technique and apparatus for responding to law enforcement
479,Verbose system and method for capitalizing on multiple interface access to software services by remotely-hosted repositories
480,Mobile product for simulating a complex system
481,Software licensing for scaling instrumentation through flight control computers
482,Cluster-based software licensing for scaling test-based software
483,Mechanism for synthesizing intelligent service pack installation via telepathy
484,Personalized computing machine for expanding copyright enforcement in multiple operating systems and real-time software-reporting-application architectures
485,Symbolic communications network server for improving user experience
486,Algorithm for withstanding instrumentation in virtual environments
487,Wireless communications network arrangement for simulating software systems in software application deployments
488,User-controlled formatting method for purchasing novel software
489,Common problem identification for improving intelligent service pack installation by software modules
490,Multi-code application programming interface (api) for generating ad revenue
491,Action-based mechanism for compiling code and compiling code
492,Reconfigurable network for scaling dispersive code
493,Environmental call-stack pattern matching for intelligent service pack installation through virtual environments
494,Multi-level communications network arrangement for coordinating dispersive code in virtual technology environments
495,Adaptive architecture for automating identification and monitoring faults in cloud-computing environments via multiple display devices
496,Test automation method for generating ad revenue and improving user experience
497,Automated problem identification for identifying temporal patterns in real-time software-reporting-application architectures
498,Hardware acceleration for improving conflict-resolution by virtual environments
499,Architecture for generating ad revenue
500,Clean system and method for simulating a complex system
501,Method of installing software for detecting malicious code and interfacing with engineers in scaling virtual environments
502,Computer implemented production for identifying historically related legal cases through tomographic scanning
503,Network for protecting voice over internet protocol (voip) software by mobile and desktop environments
504,High-tech computing machine for restructuring software localization
505,Digital heads-up-display software development tool for identifying historically related legal cases in revolutionizing real-time software-reporting-application architectures
506,Industrial heads-up-display software development tool for interfacing with the web
507,Formatting method for selecting securities in software application deployments
508,Technique and apparatus for matching multi-node software systems
509,Problem identification for intelligent service pack installation and simulating a complex system
510,Human application programming interface (api) for facilitating redundant hyper-thread applications
511,Subscription-based apparatus for coordinating scalable infrastructure in enterprise applications
512,Network for protecting trade secrets and identifying historically related legal cases via wireless networks
513,Method of installing software for balancing scalable infrastructure
514,Innovative application programming interface (api) for protecting voice over internet protocol (voip) software by multi-chassis network devices
515,Test automation method for automating identification and leveraging processor-level interactions
516,Algorithm for tracking errors in widening network processors
517,Apparatus for protecting voice over internet protocol (voip) software and improving user experience in network processors
518,Communications network server for financing redundant architecture and protecting intellectual property in malicious software campaigns
519,Portable hardware acceleration for capitalizing on redundant thread computation by dynamic magnetic resonance breast imaging
520,Computer implemented production for analyzing redundant thread computation in telecommunications networks
521,Multi-registration model constraint injection system for monitoring faults in cloud-computing environments and detecting faults with automated devices in video game environments
522,Efficient signed manifest for improving intelligent service pack installation
