patent_id,name
523,Software-based algorithm for protecting trade secrets in coordinating government law enforcement
524,Predictive communications network arrangement for compiling code
525,Personalized algorithm for protecting trade secrets
526,Computing machine for financing redundant architecture in enhancing software identifier standards
527,Product for identifying temporal patterns in expanding enterprise applications
528,System to remotely enable software-based options for automating identification in software-defined communication systems
529,Mechanism for compiling code and identifying historically related legal cases
530,Subscription-based communications network server for interfacing with engineers in multiple display devices
531,Network for withstanding software localization
532,Symbolic portal for purchasing novel software and detecting faults with automated devices through politics
533,Web-based computer implemented production for automating identification and matching multi-node software systems in documenting politics
534,Social software licensing for monitoring faults in cloud-computing environments in improving software configurations
535,Mobile problem identification for protecting voice over internet protocol (voip) software and interfacing with engineers
536,Automated software entity for implementing multiple interface access to software services
537,Software entity for generating ad revenue via teletherapy
538,System for selecting securities and integrating service frameworks in electronic devices
539,Algorithm for responding to law enforcement
540,Heads-up-display software development tool for protecting trade secrets by visual modeling software
541,Private hardware acceleration for leveraging processor-level interactions and simulating a complex system
542,Heads-up-display software development tool for electing public officials in malicious software campaigns
543,Transparent system to remotely enable software-based options for leveraging processor-level interactions in multiple operating systems
544,Heads-up-display software development tool for protecting voice over internet protocol (voip) software
545,Constraint injection system for selecting securities in computer software libraries and transactional memory systems
546,Product for restructuring redundant hyper-thread applications
547,Mechanism for implementing conflict-resolution
548,Green test automation method for generating ad revenue in computer software libraries
549,Apparatus for implementing software localization in risk-based software testing
550,System and method for tracking errors in centralized software development systems
551,Memory-based signed manifest for improving user experience in network processors
552,Diagnostic software-implemented framework for analyzing the creation of a hybrid cycle simulation model
553,Iterative algorithm for tracking errors in restructuring multiple display devices
554,Symbolic communications network server for simulating software systems via highly constrained memory situations
555,Network for interfacing with engineers
556,Semantic computer implemented production for transferring data through computer programming languages
557,Algorithm for interfacing with engineers in telecommunications networks
558,Signed manifest for simulating a complex system and purchasing novel software in network processors
559,Communications network server for identifying historically related legal cases and electing public officials
560,Conditional computing machine for compiling code and detecting malicious code
561,Software-definable network for purchasing novel software and selecting securities
562,Communications network arrangement for expanding scalable infrastructure
563,Configurable method of installing software for matching multi-node software systems in synthesizing multiple display devices
564,Software for protecting trade secrets and protecting trade secrets
565,Portal for electing public officials in results-based business proposals
566,Multi-machine computer readable medium for tracking errors through social media campaigns
567,Multi-faceted portal for intelligent service pack installation in dynamic magnetic resonance breast imaging and government law enforcement
568,Computer readable medium for detecting faults with automated devices and purchasing novel software in risk-based software testing
569,Technique and apparatus for widening conflict-resolution in balancing multiple display devices
570,Architecture for detecting faults with automated devices
571,Social network for scaling scalable infrastructure
572,Cluster-based methodology for purchasing novel software in social media campaigns
573,Product for enhancing multiple interface access to software services
574,Industrial software for selecting securities in complex software dependencies
575,Computing machine for enhancing intelligent service pack installation
576,Computing machine for interfacing with the web and transferring data
577,Clean architecture for enhancing multiple interface access to software services via a software communications architecture (sca) framework
578,"Methodology for transferring data in balancing computer software libraries, telepathy, and  software application deployments"
579,Quantum-based system for interfacing with engineers and purchasing novel software by social media campaigns
580,Automated methodology for integrating service frameworks and detecting faults with automated devices
581,Computer readable medium for detecting malicious code through a software communications architecture (sca) framework
582,Iterative software for documenting software localization
583,User-controlled method for intelligent service pack installation by software modules
584,Technique and apparatus for responding to law enforcement and generating ad revenue
585,Formatting method for protecting voice over internet protocol (voip) software and protecting voice over internet protocol (voip) software in enterprise applications
586,Problem identification for protecting trade secrets in unsynchronized networks and computer software libraries
587,Communications network arrangement for optimizing software localization
588,Software entity for automating identification and monitoring faults in cloud-computing environments
589,Methodology for automating identification and compiling code in graphical user interfaces and multiple operating systems
590,Digital portal for expanding instrumentation in enhancing software-defined communication systems
591,Method for generating interactive applications in electronic devices
592,Multi-code system for expanding conflict-resolution in scaling complex software dependencies
593,Problem identification for improving user experience by real-time software-reporting-application architectures
594,Clean system and method for leveraging processor-level interactions and automating identification in complex software dependencies
595,Problem identification for automating identification through social media for political campaigns
596,Network for protecting intellectual property
597,Signed product for generating ad revenue by graphical user interfaces
598,Automatic technique and apparatus for documenting instrumentation by flight control computers
599,Product for responding to law enforcement in politics
600,Mechanism for leveraging processor-level interactions
601,Test automation method for simulating a complex system and intelligent service pack installation
602,Configurable architecture for facilitating software localization
603,Automated software-implemented framework for protecting trade secrets by telecommunications networks
604,Heterogeneous methodology for improving user experience through social media campaigns
605,Formatting method for merging redundant hyper-thread applications
606,Memory-based formatting method for purchasing novel software
607,Computer readable medium for proving redundant hyper-thread applications
608,Bandwidth-heavy application programming interface (api) for interfacing with the web and protecting intellectual property in multiple operating systems
609,"Parallelized software-implemented framework for detecting faults with automated devices in documenting provider-tenant environments, software defined contexts, and  multi-chassis network devices"
610,Constraint injection system for tracking errors in software identifier standards
611,Reconfigurable algorithm for balancing redundant hyper-thread applications
612,System and method for generating ad revenue
613,Mathematical heads-up-display software development tool for monitoring faults in cloud-computing environments and transferring data in merging telecommunications networks
614,Problem identification for electing public officials in a software communications architecture (sca) framework
615,Comprehensive technique for responding to law enforcement by provider-tenant environments
616,Heads-up-display software development tool for detecting faults with automated devices and electing public officials in software-defined communication systems and wireless networks
617,Web-based computing machine for protecting voice over internet protocol (voip) software
618,"Efficient constraint injection system for coordinating software localization in expanding enterprise applications, mobile and desktop environments, and  software-defined communication systems"
619,Software for financing redundant architecture in facilitating telecommunications networks
620,Vectorized method of installing software for revolutionizing conflict-resolution
621,Symbolic computing machine for generating interactive applications in telecommunications networks
622,"Multi-machine product for protecting intellectual property and compiling code in implementing complex software dependencies, computer software libraries, and  tomographic scanning"
623,Clean formatting method for generating ad revenue in coordinating mobile devices
624,Automated communications network server for detecting malicious code and selecting securities
625,Scheduling technique for detecting malicious code in software identifier standards
626,Scheduling technique for intelligent service pack installation and selecting securities
627,Formatting method for protecting trade secrets in facilitating transactional memory systems
628,Anti-intrusion system for simulating a complex system
629,Interactive hardware acceleration for simulating a complex system in portable devices
630,Environmental heads-up-display software development tool for enhancing redundant thread computation
631,Iterative computer readable medium for scaling multiple interface access to software services
632,System to remotely enable software-based options for detecting malicious code in graphical user interfaces
633,Scalable hardware acceleration for detecting malicious code
634,High-tech computer readable medium for simulating software systems in portable devices
635,Human methodology for matching multi-node software systems in software defined contexts
636,Mechanism for detecting malicious code and intelligent service pack installation via software identifier standards
637,Bandwidth-heavy computer readable medium for identifying historically related legal cases in portable devices
638,Software-definable method for transferring data
639,Memory-based algorithm for protecting intellectual property in security modules
640,Computer implemented production for protecting trade secrets
641,Product for generating ad revenue in provider-tenant environments
642,System for interfacing with the web
643,Distributed method for monitoring faults in cloud-computing environments
644,Hardware-based call-stack pattern matching for generating ad revenue and compiling code
645,Memory-based signed manifest for purchasing novel software
646,Hardware acceleration for matching multi-node software systems through multiple display devices
647,Vectorized method for balancing multiple interface access to software services
648,Communications network server for electing public officials and compiling code in dynamic magnetic resonance breast imaging and security modules
649,Browser-controlled hardware acceleration for simulating software systems in virtual environments and portable devices
650,Computer readable medium for improving user experience and compiling code in results-based business proposals and virtual environments
651,Mathematical system for responding to law enforcement by electronic devices
652,Mechanism for detecting malicious code
653,Scheduling technique for tracking errors through centralized software development systems
654,On-demand scheduling technique for integrating service frameworks in virtual environments
655,Test automation method for monitoring  multiple interface access to software services by teletherapy
656,Technique for leveraging processor-level interactions via malicious software campaigns
657,Transparent scheduling technique for financing redundant architecture and simulating software systems via mobile and desktop environments
658,Reusable formatting method for simulating a complex system and identifying historically related legal cases
659,"Computing machine for enhancing redundant hyper-thread applications in monitoring  telecommunications networks, software configurations, and  software configurations"
660,Private architecture for protecting intellectual property and protecting intellectual property in electronic devices
661,Multi-registration model formatting method for compiling code in computer software libraries
662,Scalable problem identification for protecting intellectual property and responding to law enforcement in wireless networks
663,Computer implemented production for intelligent service pack installation
664,Semantic call-stack pattern matching for balancing redundant thread computation in portable devices
665,Formatting method for electing public officials in software identifier standards
666,Formatting method for electing public officials and integrating service frameworks through provider-tenant environments
667,Test automation method for facilitating conflict-resolution
668,"Hardware acceleration for generating ad revenue in withstanding unsynchronized networks, software-defined communication systems, and  telecommunications networks"
669,Software-implemented framework for intelligent service pack installation in provider-tenant environments
670,Software for electing public officials and matching multi-node software systems
671,Hardware acceleration for integrating service frameworks in virtual environments
672,Subscription-based portal for matching multi-node software systems via dynamic magnetic resonance breast imaging
673,Software-implemented framework for documenting instrumentation
674,Heads-up-display software development tool for facilitating intelligent service pack installation in mobile and desktop environments and social media for political campaigns
675,Portable methodology for leveraging processor-level interactions in network processors
676,Cryptographic network for monitoring faults in cloud-computing environments and selecting securities in graphical user interfaces
677,Communications network server for synthesizing conflict-resolution
678,Parallelized technique and apparatus for balancing the creation of a hybrid cycle simulation model by risk-based software testing
679,Software for detecting faults with automated devices
680,Mobile communications network arrangement for generating ad revenue in proving security modules
681,Software entity for interfacing with engineers and interfacing with engineers
682,Human computing machine for improving user experience and integrating service frameworks
683,Efficient algorithm for generating interactive applications and identifying temporal patterns in telecommunications networks
684,Software entity for leveraging processor-level interactions in visual modeling software and security modules
685,Signed manifest for leveraging processor-level interactions and matching multi-node software systems in analyzing virtual technology environments
686,Architecture for identifying temporal patterns in complex software dependencies
687,Portable method of installing software for protecting intellectual property
688,One-click software for tracking errors
689,Hardware acceleration for optimizing redundant thread computation in computer systems and tomographic scanning
690,Interactive software for monitoring faults in cloud-computing environments and protecting voice over internet protocol (voip) software in enterprise applications
691,Memory-based methodology for detecting faults with automated devices in real-time software-reporting-application architectures
692,Industrial technique for proving intelligent service pack installation in expanding computer software libraries
693,Social computer implemented production for compiling code and generating ad revenue
694,Portal for intelligent service pack installation and protecting trade secrets
695,Scheduling technique for financing redundant architecture in social media for political campaigns
696,Software for monitoring  instrumentation in virtual environments
697,Predictive heads-up-display software development tool for protecting voice over internet protocol (voip) software and identifying historically related legal cases
698,Runtime hardware acceleration for generating ad revenue
699,Software-definable heads-up-display software development tool for implementing multiple interface access to software services
700,Mechanism for revolutionizing software localization
701,Heads-up-display software development tool for automating identification and matching multi-node software systems via security modules
702,Homogeneous computing machine for enhancing the creation of a hybrid cycle simulation model in results-based business proposals
703,Method of installing software for protecting trade secrets and simulating a complex system in computer programming languages
704,Test automation method for tracking errors in computer software libraries
705,Computer readable medium for simulating software systems in improving tomographic scanning
706,Software licensing for compiling code in malicious software campaigns and software identifier standards
707,Test automation method for selecting securities in widening real-time software-reporting-application architectures
708,Analytical algorithm for protecting intellectual property in multi-chassis network devices
709,Technique for selecting securities
710,Algorithm for monitoring faults in cloud-computing environments and intelligent service pack installation
711,Mobile architecture for improving user experience
712,Formatting method for identifying historically related legal cases in virtual technology environments
713,Mechanism for leveraging processor-level interactions in a software communications architecture (sca) framework
714,Green mechanism for widening software localization
715,Signed manifest for monitoring  software localization
716,Portable signed manifest for intelligent service pack installation
717,Software licensing for intelligent service pack installation and identifying temporal patterns in telepathy
718,Software entity for transferring data by unsynchronized networks
719,Constraint injection system for identifying temporal patterns
720,Algorithm for synthesizing test-based software by computer systems
721,User-controlled communications network server for expanding test-based software by risk-based software testing
722,Differential constraint injection system for matching multi-node software systems and identifying temporal patterns by highly constrained memory situations
723,Software-implemented framework for simulating software systems in visual modeling software
724,On-demand system to remotely enable software-based options for compiling code
725,Social software for monitoring  software localization through network processors
726,Scalable method of installing software for transferring data
727,Portal for protecting voice over internet protocol (voip) software in merging software modules
728,Comprehensive communications network server for interfacing with engineers in a software communications architecture (sca) framework
729,Software-definable system and method for simulating software systems and improving user experience
730,Coal-based constraint injection system for capitalizing on intelligent service pack installation in merging video game environments
731,Secure scheduling technique for monitoring  instrumentation in social media for political campaigns
732,Semantic technique and apparatus for protecting intellectual property and generating ad revenue in security modules
733,On-demand heads-up-display software development tool for automating identification and automating identification by software application deployments
734,Remote problem identification for analyzing dispersive code
735,Heads-up-display software development tool for financing redundant architecture
736,Verbose algorithm for transferring data via enterprise applications
737,Vectorized heads-up-display software development tool for transferring data
738,Architecture for restructuring instrumentation in merging social media
739,Product for generating interactive applications
740,Extensible software-implemented framework for capitalizing on intelligent service pack installation in merging security modules
741,Action-based algorithm for generating interactive applications and financing redundant architecture
742,Multi-machine problem identification for proving instrumentation in software configurations
743,"Test automation method for proving redundant hyper-thread applications in restructuring electronic devices, virtual technology environments, and  graphical user interfaces"
744,Stack-based methodology for financing redundant architecture through government law enforcement
745,Heads-up-display software development tool for detecting faults with automated devices
746,Software for protecting intellectual property in facilitating real-time software-reporting-application architectures
747,Secure computer readable medium for identifying temporal patterns in multiple display devices
748,Signed manifest for generating interactive applications and detecting faults with automated devices in malicious software campaigns
749,Application programming interface (api) for automating identification and matching multi-node software systems
750,Methodology for improving user experience and purchasing novel software in remotely-hosted repositories
751,Product for interfacing with engineers
752,Signed manifest for facilitating copyright enforcement via multiple display devices
753,Scientific technique for protecting voice over internet protocol (voip) software
754,Test automation method for generating ad revenue in analyzing tomographic scanning
755,One-click method for coordinating the creation of a hybrid cycle simulation model by software modules
756,Software licensing for protecting voice over internet protocol (voip) software and purchasing novel software through transactional memory systems
757,Network for detecting faults with automated devices in software identifier standards
758,Architecture for protecting intellectual property and intelligent service pack installation
759,System for monitoring  conflict-resolution
760,Portal for protecting voice over internet protocol (voip) software
761,Empirical scheduling technique for balancing the creation of a hybrid cycle simulation model in security modules and software defined contexts
762,Software-implemented framework for identifying temporal patterns
763,Scalable mechanism for monitoring  scalable infrastructure in facilitating risk-based software testing
764,System and method for electing public officials
765,Computer implemented production for generating interactive applications in enterprise applications
766,Multi-faceted signed manifest for intelligent service pack installation and simulating software systems in risk-based software testing
767,Software for transferring data in software application deployments
768,Signed manifest for synthesizing test-based software by highly constrained memory situations
769,"Technique and apparatus for implementing scalable infrastructure in widening politics, software application deployments, and  risk-based software testing"
770,Mechanism for improving user experience and simulating a complex system
771,Load-bearing architecture for protecting voice over internet protocol (voip) software and transferring data in mobile devices
772,"Human signed manifest for simulating software systems in revolutionizing mobile devices, enterprise applications, and  real-time software-reporting-application architectures"
773,Heterogeneous method of installing software for generating interactive applications via multiple operating systems
774,Network-based product for capitalizing on copyright enforcement
775,Independent mechanism for generating ad revenue
776,Secure system for synthesizing software localization
777,Reconfigurable hardware acceleration for detecting malicious code
778,Scheduling technique for interfacing with the web in transactional memory systems
779,Heads-up-display software development tool for matching multi-node software systems
780,"Algorithm for expanding redundant thread computation in merging transactional memory systems, remotely-hosted repositories, and  transactional memory systems"
781,Common software-implemented framework for transferring data and detecting faults with automated devices
782,System and method for leveraging processor-level interactions in balancing real-time software-reporting-application architectures
783,Call-stack pattern matching for leveraging processor-level interactions and protecting trade secrets
784,Network for transferring data in teletherapy
785,Architecture for coordinating software localization in electronic devices
