patent_id,name
1,Predictive software-implemented framework for interfacing with engineers in multiple operating systems
2,System to remotely enable software-based options for restructuring instrumentation through electronic devices
3,Apparatus for automating identification in mobile and desktop environments
4,Technique and apparatus for leveraging processor-level interactions
5,Green technique and apparatus for identifying temporal patterns
6,Interactive system to remotely enable software-based options for restructuring test-based software
7,Signed architecture for selecting securities in social media for political campaigns and enterprise applications
8,Problem identification for protecting intellectual property
9,Software-definable heads-up-display software development tool for generating ad revenue in video game environments
10,Heads-up-display software development tool for tracking errors by complex software dependencies
11,Network for integrating service frameworks
12,Method for protecting intellectual property in enterprise applications
13,Mobile technique for simulating software systems in software modules
14,Scalable hardware acceleration for detecting malicious code
15,Secure methodology for generating interactive applications and leveraging processor-level interactions in malicious software campaigns
16,Call-stack pattern matching for generating ad revenue
17,Computing machine for protecting trade secrets in remotely-hosted repositories
18,System for monitoring faults in cloud-computing environments in real-time software-reporting-application architectures and results-based business proposals
19,Interactive software for responding to law enforcement and selecting securities
20,Network for leveraging processor-level interactions
21,Flexible method for protecting intellectual property and purchasing novel software through a software communications architecture (sca) framework
22,Technique for financing redundant architecture in centralized software development systems and social media for political campaigns
23,Method for identifying temporal patterns and protecting voice over internet protocol (voip) software
24,Efficient heads-up-display software development tool for revolutionizing software localization
25,"Empirical product for simulating a complex system and financing redundant architecture in facilitating computer software libraries, mobile and desktop environments, and  graphical user interfaces"
26,Call-stack pattern matching for expanding test-based software through mobile and desktop environments
27,One-click hardware acceleration for monitoring  instrumentation through telecommunications networks
28,Verbose communications network server for generating ad revenue and tracking errors in computer systems
29,Mechanism for integrating service frameworks
30,Social scheduling technique for detecting malicious code in software configurations and electronic devices
31,Mechanism for protecting voice over internet protocol (voip) software in wireless networks
32,Method for identifying temporal patterns
33,Heads-up-display software development tool for simulating a complex system and transferring data
34,System and method for protecting voice over internet protocol (voip) software in enterprise applications
35,Formatting method for tracking errors and transferring data via politics
36,Semantic method of installing software for identifying temporal patterns
37,Mobile computer implemented production for responding to law enforcement in teletherapy
38,Transparent technique and apparatus for financing redundant architecture in results-based business proposals and enterprise applications
39,Software entity for generating ad revenue in tomographic scanning
40,Distributed software-implemented framework for improving user experience in visual modeling software
41,Interactive mechanism for automating identification and tracking errors via software modules
42,Heterogeneous methodology for revolutionizing dispersive code in scaling multiple display devices
43,Methodology for analyzing redundant hyper-thread applications in tomographic scanning
44,Empirical heads-up-display software development tool for generating ad revenue and intelligent service pack installation
45,Communications network arrangement for electing public officials through malicious software campaigns
46,Method of installing software for transferring data and monitoring faults in cloud-computing environments in software configurations
47,Communications network server for interfacing with the web in software defined contexts
48,Clean technique and apparatus for responding to law enforcement and purchasing novel software
49,Independent mechanism for generating interactive applications via software-defined communication systems
50,Subscription-based mechanism for identifying temporal patterns in electronic devices
51,Scheduling technique for implementing instrumentation through mobile and desktop environments
52,Network for leveraging processor-level interactions and matching multi-node software systems via multi-chassis network devices
53,Communications network server for selecting securities and simulating a complex system in telepathy and remotely-hosted repositories
54,Test automation method for responding to law enforcement
55,One-click method for intelligent service pack installation and protecting trade secrets in transactional memory systems
56,Hardware acceleration for simulating software systems via mobile and desktop environments
57,Formatting method for compiling code in real-time software-reporting-application architectures
58,Efficient method for monitoring  scalable infrastructure
59,Innovative software-implemented framework for electing public officials
60,Method for generating interactive applications in security modules
61,Software entity for restructuring instrumentation
62,Problem identification for withstanding dispersive code
63,Portal for financing redundant architecture
64,Computer readable medium for leveraging processor-level interactions via software identifier standards
65,Architecture for detecting malicious code in a software communications architecture (sca) framework
66,System for integrating service frameworks and tracking errors
67,Computer readable medium for simulating a complex system
68,"Coal-based technique for generating interactive applications and financing redundant architecture in revolutionizing malicious software campaigns, software defined contexts, and  remotely-hosted repositories"
69,Aggregate method for enhancing multiple interface access to software services
70,Mechanism for simulating software systems and identifying historically related legal cases
71,Constraint injection system for revolutionizing scalable infrastructure in computer programming languages
72,Mechanism for purchasing novel software
73,Extensible software licensing for integrating service frameworks and intelligent service pack installation in security modules
74,Cryptographic heads-up-display software development tool for monitoring faults in cloud-computing environments in facilitating visual modeling software
75,Reusable problem identification for improving redundant hyper-thread applications
76,Communications network server for detecting malicious code in computer programming languages
77,Secure signed manifest for matching multi-node software systems and financing redundant architecture in graphical user interfaces
78,Software-definable heads-up-display software development tool for widening dispersive code through software defined contexts
79,Constraint injection system for compiling code in merging malicious software campaigns
80,Communications network arrangement for identifying historically related legal cases and simulating software systems by social media for political campaigns
81,Homogeneous algorithm for simulating a complex system by complex software dependencies
82,Efficient constraint injection system for monitoring faults in cloud-computing environments in a software communications architecture (sca) framework
83,Architecture for withstanding instrumentation
84,Algorithm for simulating software systems and simulating software systems
85,Iterative problem identification for scaling intelligent service pack installation
86,Cloud-based portal for monitoring  dispersive code in social media campaigns
87,Communications network arrangement for simulating a complex system by software application deployments
88,User-controlled system and method for documenting the creation of a hybrid cycle simulation model
89,Formatting method for simulating a complex system and protecting trade secrets through real-time software-reporting-application architectures
90,Coal-based network for compiling code and tracking errors
91,Algorithm for financing redundant architecture in visual modeling software
92,System for tracking errors by virtual environments
93,Scheduling technique for implementing copyright enforcement in government law enforcement
94,Signed manifest for simulating software systems and improving user experience in social media for political campaigns
95,Software for tracking errors through telepathy
96,Action-based software entity for selecting securities and protecting voice over internet protocol (voip) software
97,Browser-controlled system to remotely enable software-based options for interfacing with the web in mobile and desktop environments and telecommunications networks
98,Methodology for tracking errors in security modules
99,Transparent software-implemented framework for transferring data in social media
100,Software entity for integrating service frameworks
101,Portal for selecting securities
102,Computer readable medium for automating identification
103,Hardware acceleration for integrating service frameworks in analyzing dynamic magnetic resonance breast imaging
104,Network for proving scalable infrastructure in video game environments
105,Symbolic mechanism for restructuring software localization in teletherapy
106,Portable mechanism for identifying temporal patterns by telepathy
107,High-tech architecture for tracking errors and electing public officials via social media
108,Network for selecting securities and identifying historically related legal cases
109,Network-based technique and apparatus for facilitating multiple interface access to software services
110,Software-implemented framework for integrating service frameworks and interfacing with the web in dynamic magnetic resonance breast imaging and risk-based software testing
111,Multi-code apparatus for compiling code in widening teletherapy
112,Method of installing software for facilitating redundant thread computation
113,Mechanism for improving redundant thread computation
114,Signed manifest for detecting malicious code and integrating service frameworks in dynamic magnetic resonance breast imaging
115,Conditional system and method for documenting test-based software in computer software libraries
116,Architecture for automating identification and generating interactive applications in virtual technology environments
117,Coal-based methodology for financing redundant architecture
118,Formatting method for responding to law enforcement
119,Formatting method for interfacing with engineers and protecting intellectual property
120,Algorithm for detecting faults with automated devices
121,Subscription-based software-implemented framework for balancing test-based software through wireless networks
122,Network for purchasing novel software and compiling code
123,Technique for matching multi-node software systems
124,System to remotely enable software-based options for selecting securities and improving user experience in software configurations
125,Formatting method for detecting malicious code in unsynchronized networks and telepathy
126,Multi-code formatting method for transferring data through complex software dependencies
127,System to remotely enable software-based options for facilitating redundant thread computation in telepathy
128,"Scheduling technique for automating identification and simulating a complex system in implementing unsynchronized networks, software defined contexts, and  unsynchronized networks"
129,Conditional system and method for improving user experience through politics
130,Semantic call-stack pattern matching for tracking errors
131,Scientific computing machine for improving instrumentation in complex software dependencies
132,Mathematical communications network arrangement for interfacing with the web and financing redundant architecture
133,Software for scaling test-based software
134,Automated heads-up-display software development tool for facilitating software localization
135,Application programming interface (api) for simulating software systems and purchasing novel software through multi-chassis network devices
136,Signed manifest for protecting intellectual property
137,Green computer implemented production for monitoring faults in cloud-computing environments in facilitating electronic devices
138,Call-stack pattern matching for matching multi-node software systems in dynamic magnetic resonance breast imaging
139,System to remotely enable software-based options for withstanding copyright enforcement in unsynchronized networks and results-based business proposals
140,Web-based scheduling technique for tracking errors in optimizing software application deployments
141,Problem identification for responding to law enforcement in malicious software campaigns
142,Runtime signed manifest for protecting trade secrets and matching multi-node software systems in documenting software defined contexts
143,Homogeneous hardware acceleration for widening redundant hyper-thread applications in tomographic scanning
144,Runtime method for generating ad revenue in software modules and transactional memory systems
145,Memory-based system to remotely enable software-based options for financing redundant architecture in transactional memory systems
146,Call-stack pattern matching for identifying temporal patterns and transferring data
147,Computer readable medium for compiling code and identifying temporal patterns in widening mobile devices
148,System and method for protecting voice over internet protocol (voip) software in flight control computers
149,Mechanism for leveraging processor-level interactions in mobile and desktop environments
150,Signed call-stack pattern matching for purchasing novel software
151,Product for purchasing novel software through telepathy
152,Communications network server for financing redundant architecture and simulating a complex system in widening graphical user interfaces
153,System for responding to law enforcement and monitoring faults in cloud-computing environments via mobile and desktop environments
154,On-demand hardware acceleration for integrating service frameworks and protecting voice over internet protocol (voip) software through unsynchronized networks
155,Bandwidth-heavy technique for facilitating software localization via politics
156,Scheduling technique for protecting intellectual property
157,Method of installing software for identifying temporal patterns through a software communications architecture (sca) framework
158,Stack-based communications network arrangement for electing public officials in dynamic magnetic resonance breast imaging
159,Conditional mechanism for purchasing novel software in telepathy
160,Technique and apparatus for documenting multiple interface access to software services in software defined contexts
161,Heads-up-display software development tool for restructuring conflict-resolution
162,High-tech product for protecting voice over internet protocol (voip) software in enhancing risk-based software testing
163,"Environmental computer readable medium for financing redundant architecture in capitalizing on mobile devices, computer programming languages, and  network processors"
164,Cryptographic system to remotely enable software-based options for leveraging processor-level interactions
165,Human software-implemented framework for protecting voice over internet protocol (voip) software in telepathy
166,Predictive call-stack pattern matching for monitoring faults in cloud-computing environments in provider-tenant environments
167,Flexible methodology for compiling code in software identifier standards
168,Interactive algorithm for leveraging processor-level interactions
169,Software entity for matching multi-node software systems
170,Secure technique and apparatus for leveraging processor-level interactions and simulating software systems in wireless networks
171,Constraint injection system for transferring data via virtual environments
172,Diagnostic system for simulating software systems and financing redundant architecture
173,Network-based signed manifest for improving user experience by virtual environments
174,Automated system for matching multi-node software systems
175,Method for interfacing with engineers
176,Method of installing software for intelligent service pack installation in unsynchronized networks
177,Technique and apparatus for enhancing intelligent service pack installation through network processors
178,"Browser-controlled method for facilitating software localization in merging multi-chassis network devices, politics, and  tomographic scanning"
179,Public mechanism for widening software localization in virtual technology environments and visual modeling software
180,Methodology for identifying temporal patterns by provider-tenant environments
181,Methodology for proving copyright enforcement in software modules
182,Digital software licensing for selecting securities and responding to law enforcement
183,Cluster-based heads-up-display software development tool for selecting securities and detecting malicious code through provider-tenant environments
184,Mechanism for financing redundant architecture and intelligent service pack installation in transactional memory systems
185,Problem identification for detecting faults with automated devices and detecting faults with automated devices
186,Method of installing software for merging the creation of a hybrid cycle simulation model
187,"Computer readable medium for automating identification and purchasing novel software in restructuring virtual environments, results-based business proposals, and  virtual technology environments"
188,Cryptographic test automation method for restructuring the creation of a hybrid cycle simulation model in portable devices and computer software libraries
189,Digital method for merging the creation of a hybrid cycle simulation model
190,Formatting method for integrating service frameworks and identifying temporal patterns
191,Network for selecting securities and identifying historically related legal cases through politics
192,Technique for restructuring conflict-resolution via social media
193,Hardware acceleration for proving the creation of a hybrid cycle simulation model in graphical user interfaces
194,Multi-code method for enhancing scalable infrastructure in synthesizing multiple display devices
195,Software-based computing machine for interfacing with the web and interfacing with engineers in software defined contexts
196,Test automation method for leveraging processor-level interactions and integrating service frameworks
197,Industrial algorithm for tracking errors and improving user experience in highly constrained memory situations and virtual environments
198,Communications network arrangement for compiling code and simulating a complex system in real-time software-reporting-application architectures
199,Runtime constraint injection system for detecting malicious code and protecting intellectual property via multiple display devices
200,Constraint injection system for generating ad revenue
201,On-demand scheduling technique for identifying temporal patterns in coordinating virtual environments
202,Signed manifest for financing redundant architecture
203,System and method for restructuring intelligent service pack installation
204,Software-implemented framework for responding to law enforcement by real-time software-reporting-application architectures
205,Comprehensive system to remotely enable software-based options for detecting faults with automated devices through virtual environments
206,Method for generating ad revenue and tracking errors in results-based business proposals
207,"Signed product for purchasing novel software in capitalizing on electronic devices, virtual environments, and  wireless networks"
208,Mechanism for simulating a complex system through mobile devices
209,Iterative method for automating identification and financing redundant architecture via transactional memory systems
210,Software-definable methodology for scaling redundant hyper-thread applications by multiple operating systems
211,Communications network arrangement for responding to law enforcement by centralized software development systems
212,Network for intelligent service pack installation in telepathy and software modules
213,Technique and apparatus for protecting intellectual property through video game environments
214,System and method for simulating a complex system and protecting voice over internet protocol (voip) software in multi-chassis network devices
215,Cryptographic computer readable medium for simulating software systems by real-time software-reporting-application architectures
216,Digital product for monitoring faults in cloud-computing environments and purchasing novel software
217,"Social communications network arrangement for monitoring faults in cloud-computing environments in facilitating software identifier standards, a software communications architecture (sca) framework, and  software defined contexts"
218,Software licensing for implementing redundant thread computation in computer software libraries
219,Apparatus for simulating a complex system and transferring data
220,Personalized technique and apparatus for automating identification and interfacing with engineers
221,Constraint injection system for responding to law enforcement
222,Problem identification for protecting intellectual property in politics
223,Scheduling technique for interfacing with engineers via remotely-hosted repositories
224,Software for integrating service frameworks and generating ad revenue
225,One-click constraint injection system for automating identification
226,Anti-intrusion software licensing for restructuring the creation of a hybrid cycle simulation model in network processors
227,Apparatus for protecting voice over internet protocol (voip) software and responding to law enforcement
228,Empirical call-stack pattern matching for tracking errors in enhancing software configurations
229,Communications network server for protecting trade secrets
230,Method for monitoring  copyright enforcement
231,Parallelized method for identifying temporal patterns in telepathy
232,Heads-up-display software development tool for leveraging processor-level interactions and generating ad revenue in complex software dependencies
233,System and method for tracking errors in transactional memory systems
234,Industrial test automation method for intelligent service pack installation in telepathy
235,Network-based software entity for generating interactive applications by wireless networks
236,Product for protecting intellectual property and interfacing with the web in politics
237,Method for protecting trade secrets by government law enforcement
238,Empirical hardware acceleration for interfacing with engineers
239,Quantum-based constraint injection system for merging copyright enforcement in graphical user interfaces
240,Signed manifest for generating interactive applications through teletherapy
241,Algorithm for responding to law enforcement and electing public officials in tomographic scanning
242,"Software-based heads-up-display software development tool for automating identification in capitalizing on teletherapy, telepathy, and  software-defined communication systems"
243,Multi-registration model product for detecting malicious code in merging software modules
244,Hardware acceleration for detecting malicious code in optimizing unsynchronized networks
245,Symbolic mechanism for purchasing novel software
246,Scheduling technique for generating interactive applications
247,Technique for protecting voice over internet protocol (voip) software
248,Constraint injection system for responding to law enforcement in government law enforcement
249,Common technique for generating ad revenue in portable devices and multi-chassis network devices
250,Software-implemented framework for simulating a complex system
251,Interactive scheduling technique for protecting intellectual property and simulating a complex system in network processors
252,Problem identification for protecting voice over internet protocol (voip) software
253,One-click scheduling technique for protecting trade secrets in security modules
254,Differential software-implemented framework for leveraging processor-level interactions
255,Symbolic portal for proving test-based software
256,Automated software licensing for interfacing with engineers and automating identification in software-defined communication systems
257,Technique for transferring data in virtual technology environments
258,Network for improving user experience in flight control computers
259,Multi-registration model test automation method for generating ad revenue by software identifier standards
260,Interactive algorithm for electing public officials and improving user experience
261,Private portal for simulating software systems in tomographic scanning
262,Interactive product for intelligent service pack installation in flight control computers
263,Symbolic portal for integrating service frameworks
264,Common call-stack pattern matching for leveraging processor-level interactions and generating interactive applications by wireless networks
