patent_id,name
786,Software for generating interactive applications in software application deployments
787,System and method for interfacing with engineers in social media for political campaigns
788,Formatting method for detecting faults with automated devices and identifying temporal patterns in transactional memory systems
789,Diagnostic signed manifest for analyzing intelligent service pack installation in complex software dependencies
790,Conditional constraint injection system for electing public officials in remotely-hosted repositories
791,Anti-intrusion methodology for facilitating dispersive code
792,Hardware-based system to remotely enable software-based options for intelligent service pack installation and simulating a complex system in graphical user interfaces
793,Aggregate method for purchasing novel software and financing redundant architecture by government law enforcement
794,Cloud-based method for merging redundant hyper-thread applications in optimizing software defined contexts
795,Multi-machine algorithm for interfacing with the web and matching multi-node software systems in teletherapy
796,Predictive computing machine for generating interactive applications
797,System and method for intelligent service pack installation in network processors
798,Anti-intrusion call-stack pattern matching for responding to law enforcement and protecting voice over internet protocol (voip) software in multiple operating systems
799,System and method for responding to law enforcement
800,Computing machine for identifying temporal patterns and interfacing with the web
801,Coal-based network for identifying temporal patterns through dynamic magnetic resonance breast imaging
802,Innovative communications network server for simulating a complex system
803,Call-stack pattern matching for widening scalable infrastructure
804,Green technique and apparatus for facilitating redundant hyper-thread applications via software defined contexts
805,Adaptive method of installing software for facilitating scalable infrastructure by social media for political campaigns
806,Algorithm for protecting voice over internet protocol (voip) software in electronic devices
807,Communications network arrangement for coordinating the creation of a hybrid cycle simulation model by results-based business proposals
808,Test automation method for identifying temporal patterns
809,Empirical system for synthesizing conflict-resolution
810,Software-implemented framework for improving user experience and simulating a complex system in highly constrained memory situations
811,Differential apparatus for protecting voice over internet protocol (voip) software
812,Methodology for identifying historically related legal cases in transactional memory systems
813,Software-implemented framework for simulating a complex system via software modules
814,Predictive methodology for generating ad revenue and generating interactive applications in tomographic scanning
815,Web-based communications network server for proving redundant hyper-thread applications in security modules and software application deployments
816,Human software for documenting conflict-resolution in virtual technology environments
817,Methodology for leveraging processor-level interactions through government law enforcement
818,Constraint injection system for revolutionizing conflict-resolution
819,Efficient application programming interface (api) for leveraging processor-level interactions in flight control computers
820,Private software for coordinating multiple interface access to software services
821,Common communications network server for financing redundant architecture and simulating a complex system
822,"Multi-registration model signed manifest for improving user experience in merging social media, virtual environments, and  wireless networks"
823,Reusable computer implemented production for detecting malicious code in enterprise applications and computer systems
824,Method for generating ad revenue
825,Method of installing software for protecting voice over internet protocol (voip) software in electronic devices
826,Diagnostic system to remotely enable software-based options for balancing redundant hyper-thread applications
827,Method of installing software for interfacing with engineers in computer systems
828,Technique and apparatus for generating ad revenue via multiple display devices
829,Clean application programming interface (api) for protecting trade secrets in virtual environments
830,Multi-registration model communications network arrangement for leveraging processor-level interactions in security modules
831,Scheduling technique for identifying historically related legal cases and purchasing novel software in enterprise applications
832,Multi-code signed manifest for merging intelligent service pack installation in graphical user interfaces
833,Verbose software entity for responding to law enforcement
834,Software for protecting intellectual property and interfacing with engineers in network processors
835,Semantic network for selecting securities by electronic devices
836,Public software entity for simulating a complex system and interfacing with the web
837,Independent hardware acceleration for protecting voice over internet protocol (voip) software in enhancing transactional memory systems
838,Communications network arrangement for monitoring  instrumentation via real-time software-reporting-application architectures
839,Comprehensive system to remotely enable software-based options for tracking errors and transferring data
840,Call-stack pattern matching for compiling code through software identifier standards
841,Efficient network for selecting securities
842,"Software entity for revolutionizing conflict-resolution in widening computer software libraries, multiple display devices, and  unsynchronized networks"
843,Network for transferring data
844,Scientific computing machine for tracking errors via tomographic scanning
845,Scalable computing machine for identifying temporal patterns by mobile and desktop environments
846,Coal-based architecture for monitoring faults in cloud-computing environments
847,Memory-based methodology for merging conflict-resolution via malicious software campaigns
848,Verbose technique and apparatus for implementing copyright enforcement in remotely-hosted repositories and results-based business proposals
849,Bandwidth-heavy computer implemented production for integrating service frameworks through tomographic scanning
850,Software-definable system and method for responding to law enforcement in virtual technology environments and real-time software-reporting-application architectures
851,Independent hardware acceleration for leveraging processor-level interactions in documenting portable devices
852,Apparatus for detecting faults with automated devices in politics and centralized software development systems
853,Problem identification for integrating service frameworks in real-time software-reporting-application architectures
854,Communications network server for merging the creation of a hybrid cycle simulation model
855,Stack-based apparatus for identifying temporal patterns and identifying historically related legal cases in capitalizing on complex software dependencies
856,Computer implemented production for automating identification in proving portable devices
857,Cluster-based method for widening scalable infrastructure in a software communications architecture (sca) framework
858,Portable portal for financing redundant architecture in highly constrained memory situations and complex software dependencies
859,Digital software-implemented framework for revolutionizing dispersive code in provider-tenant environments
860,Multi-registration model computer implemented production for implementing copyright enforcement
861,Mechanism for improving user experience
862,Scheduling technique for electing public officials through graphical user interfaces
863,Industrial apparatus for identifying temporal patterns
864,System to remotely enable software-based options for generating ad revenue in computer programming languages
865,Independent portal for simulating a complex system through software application deployments
866,Application programming interface (api) for leveraging processor-level interactions and identifying historically related legal cases via multiple display devices
867,Common signed manifest for interfacing with engineers
868,Independent technique and apparatus for protecting trade secrets via a software communications architecture (sca) framework
869,Method of installing software for purchasing novel software
870,Technique and apparatus for protecting intellectual property and protecting intellectual property
871,Software for widening intelligent service pack installation
872,Portal for identifying temporal patterns in proving mobile devices
873,Problem identification for purchasing novel software and protecting voice over internet protocol (voip) software
874,Reusable constraint injection system for merging redundant hyper-thread applications
875,Memory-based software-implemented framework for identifying historically related legal cases in multiple display devices
876,Constraint injection system for protecting voice over internet protocol (voip) software and protecting trade secrets in telepathy and mobile and desktop environments
877,Scalable constraint injection system for simulating software systems and identifying historically related legal cases in dynamic magnetic resonance breast imaging
878,Communications network server for optimizing redundant hyper-thread applications in tomographic scanning
879,Signed manifest for simulating software systems and generating interactive applications in network processors
880,Predictive application programming interface (api) for restructuring redundant hyper-thread applications in visual modeling software and multi-chassis network devices
881,Homogeneous application programming interface (api) for transferring data and intelligent service pack installation in multi-chassis network devices
882,Cluster-based algorithm for monitoring faults in cloud-computing environments in remotely-hosted repositories
883,"System and method for intelligent service pack installation in improving complex software dependencies, electronic devices, and  transactional memory systems"
884,Method of installing software for interfacing with the web by virtual environments
885,Multi-registration model heads-up-display software development tool for monitoring  redundant hyper-thread applications in centralized software development systems
886,Browser-controlled computer implemented production for capitalizing on intelligent service pack installation
887,Predictive computer readable medium for interfacing with the web and electing public officials in multiple operating systems
888,High-tech communications network arrangement for integrating service frameworks via mobile and desktop environments
889,Verbose problem identification for financing redundant architecture
890,Cluster-based test automation method for optimizing conflict-resolution in synthesizing unsynchronized networks
891,Portable constraint injection system for electing public officials through government law enforcement
892,Subscription-based software for electing public officials through wireless networks
893,Web-based software entity for identifying temporal patterns
894,Method of installing software for electing public officials and matching multi-node software systems through enterprise applications
895,Problem identification for synthesizing instrumentation in teletherapy
896,Hardware acceleration for synthesizing multiple interface access to software services in visual modeling software
897,Computer implemented production for protecting intellectual property in centralized software development systems
898,Signed manifest for generating interactive applications in centralized software development systems
899,Software-definable method of installing software for detecting malicious code and identifying temporal patterns
900,Computing machine for matching multi-node software systems in virtual environments
901,Communications network arrangement for transferring data in malicious software campaigns
902,Technique for integrating service frameworks
903,Technique and apparatus for protecting trade secrets and identifying historically related legal cases in enhancing results-based business proposals
904,Software entity for compiling code via video game environments
905,On-demand method of installing software for selecting securities in video game environments and network processors
906,Cluster-based system for responding to law enforcement and financing redundant architecture in a software communications architecture (sca) framework
907,Test automation method for proving conflict-resolution in coordinating software modules
908,Bandwidth-heavy signed manifest for leveraging processor-level interactions in provider-tenant environments
909,Software-implemented framework for identifying temporal patterns in monitoring  electronic devices
910,Computer implemented production for matching multi-node software systems in multiple display devices
911,Constraint injection system for responding to law enforcement and protecting voice over internet protocol (voip) software in results-based business proposals
912,Multi-faceted heads-up-display software development tool for financing redundant architecture and matching multi-node software systems in visual modeling software
913,Apparatus for compiling code and identifying historically related legal cases in telepathy and a software communications architecture (sca) framework
914,Action-based technique for leveraging processor-level interactions
915,Computing machine for identifying historically related legal cases in telecommunications networks
916,Computer readable medium for simulating software systems and integrating service frameworks in virtual technology environments
917,Architecture for tracking errors and interfacing with engineers
918,Multi-machine call-stack pattern matching for optimizing multiple interface access to software services in telecommunications networks
919,Multi-level software for protecting intellectual property and leveraging processor-level interactions
920,Technique for matching multi-node software systems in telepathy
921,Signed formatting method for identifying historically related legal cases in mobile and desktop environments
922,Distributed apparatus for automating identification by multi-chassis network devices
923,Portable method for intelligent service pack installation in virtual technology environments
924,Computing machine for restructuring intelligent service pack installation
925,Efficient method of installing software for protecting intellectual property and compiling code
926,Methodology for integrating service frameworks via telepathy
927,Test automation method for monitoring  test-based software in centralized software development systems
928,Diagnostic constraint injection system for automating identification
929,Formatting method for monitoring faults in cloud-computing environments and detecting malicious code
930,Quantum-based system to remotely enable software-based options for automating identification and protecting intellectual property by results-based business proposals
931,Runtime algorithm for monitoring faults in cloud-computing environments and protecting intellectual property in virtual environments
932,Hardware-based software entity for restructuring scalable infrastructure
933,Cluster-based software entity for identifying temporal patterns
934,Constraint injection system for electing public officials and identifying temporal patterns in social media campaigns
935,Method of installing software for selecting securities
936,Subscription-based mechanism for protecting trade secrets in highly constrained memory situations
937,Personalized architecture for identifying historically related legal cases
938,"System to remotely enable software-based options for integrating service frameworks in monitoring  mobile devices, telepathy, and  malicious software campaigns"
939,Signed system and method for documenting scalable infrastructure
940,Mobile apparatus for leveraging processor-level interactions and detecting faults with automated devices through portable devices
941,Apparatus for generating ad revenue
942,System for protecting intellectual property and detecting malicious code
943,Load-bearing communications network server for compiling code in multi-chassis network devices
944,Anti-intrusion constraint injection system for scaling redundant thread computation by computer programming languages
945,Environmental software for selecting securities in a software communications architecture (sca) framework
946,Call-stack pattern matching for balancing multiple interface access to software services by security modules
947,Scheduling technique for interfacing with the web
948,Test automation method for electing public officials
949,Bandwidth-heavy method for selecting securities and protecting trade secrets in portable devices
950,Independent technique for intelligent service pack installation and transferring data
951,System for documenting dispersive code
952,Product for simulating software systems and simulating software systems
953,Coal-based computer readable medium for enhancing intelligent service pack installation
954,Reusable network for financing redundant architecture by teletherapy
955,Software-implemented framework for responding to law enforcement by politics
956,Multi-machine communications network arrangement for simulating a complex system and selecting securities in tomographic scanning
957,Stack-based formatting method for selecting securities in optimizing software configurations
958,Communications network arrangement for financing redundant architecture and responding to law enforcement in widening social media campaigns
959,Software-implemented framework for expanding test-based software through software modules
960,Test automation method for simulating software systems by politics
961,Distributed method of installing software for improving user experience
962,Hardware-based software licensing for widening software localization in improving virtual technology environments
963,Bandwidth-heavy computer readable medium for synthesizing test-based software
964,Load-bearing software licensing for leveraging processor-level interactions
965,Action-based system for tracking errors
966,Mobile software for detecting malicious code
967,Network-based software for protecting voice over internet protocol (voip) software through software-defined communication systems
968,Efficient method for expanding software localization
969,Industrial problem identification for improving user experience
970,Software-implemented framework for detecting malicious code in security modules
971,System for identifying historically related legal cases in politics
972,Call-stack pattern matching for simulating software systems in coordinating flight control computers
973,Hardware acceleration for matching multi-node software systems in visual modeling software
974,Scalable signed manifest for implementing intelligent service pack installation
975,Call-stack pattern matching for improving user experience in multi-chassis network devices
976,Empirical call-stack pattern matching for matching multi-node software systems in implementing complex software dependencies
977,Independent system to remotely enable software-based options for capitalizing on multiple interface access to software services
978,Software-implemented framework for identifying historically related legal cases in telepathy and video game environments
979,Architecture for automating identification and interfacing with the web in social media
980,Hardware acceleration for purchasing novel software in malicious software campaigns
981,Mechanism for interfacing with engineers
982,Load-bearing software licensing for analyzing multiple interface access to software services
983,Architecture for analyzing software localization in highly constrained memory situations
984,Communications network server for financing redundant architecture in portable devices
985,Scientific technique for documenting test-based software by flight control computers
986,Parallelized hardware acceleration for financing redundant architecture in multiple operating systems and a software communications architecture (sca) framework
987,Efficient technique and apparatus for balancing the creation of a hybrid cycle simulation model by enterprise applications
988,On-demand heads-up-display software development tool for electing public officials in network processors and remotely-hosted repositories
989,Configurable application programming interface (api) for financing redundant architecture in multi-chassis network devices
990,Comprehensive call-stack pattern matching for financing redundant architecture and compiling code in software-defined communication systems and enterprise applications
991,Architecture for protecting trade secrets and matching multi-node software systems in computer software libraries
992,Remote software-implemented framework for interfacing with engineers and purchasing novel software in virtual environments
993,Software-definable technique for improving user experience and leveraging processor-level interactions in computer software libraries
994,Automated apparatus for automating identification and leveraging processor-level interactions
995,"Communications network server for monitoring  conflict-resolution in enhancing software defined contexts, software configurations, and  software identifier standards"
996,Anti-intrusion method of installing software for improving user experience
997,Interactive computer implemented production for simulating software systems
998,Computing machine for protecting trade secrets
999,Portal for enhancing copyright enforcement
1000,Call-stack pattern matching for enhancing scalable infrastructure in real-time software-reporting-application architectures
